subscriberId,date,associatedDocument,code,correlationOrder,description,id,action,issue.issue.code.code,issue.issue.description.description,fieldActivity,observation,reason,task,type,updateDate,lostEquipment,device,item,gponAccess,order.type,statusCode,scenario
"SVTAL001","2023-09-21T14:25:36Z","VTT001","1","CORR1234567890123456789012345","Successful operation","ID12345","create","00","No issues","FieldWork1","Observed1","Reason1","Task1","Type1","2023-09-21T15:25:36Z","False","Device1","Item1","Access1","OrderType1",204,"Operação realizada com sucesso"
"INVALID001","not-a-date-time","DOCINVALID","5","InvalidCorrelationLengthExceeded","Description too long for valid processing within the system constraints that are expected to be met by the application handling this data","InvalidIDLength","delete","99","Invalid issue description exceeds maximum length","InvalidActivity","InvalidObservation","InvalidReason","InvalidTask","InvalidType","InvalidDate","Maybe","InvalidDevice","InvalidItem","InvalidAccess","InvalidOrderType",400,"BadRequest"
"INVALID002","invalid-date-format","DOC002","-2","InvalidCorrelation002","Unauthorized access attempt detected","ID002","update","101","Invalid credentials provided, access denied","FieldWork2","Observed2","Reason2","Task2","Type2","2023-09-22T16:25:36Z","True","Device2","Item2","Access2","OrderType2",401,"Unauthorized"
"INVALID003","2023-09-23T17:25:36Z","DOC003","6","InvalidCorrelation003","Server error occurred while processing the request","ID003","retrieve","102","System failure, unable to process request at this time","FieldWork3","Observed3","Reason3","Task3","Type3","InvalidDateTimeFormat","False","Device3","Item3","Access3","OrderType3",500,"ServerError"
"INVALID004","invalid-date-time-004","DOC004","7","InvalidCorrelation004","Service temporarily unavailable","ID004","suspend","103","Service disruption, system temporarily unavailable","FieldWork4","Observed4","Reason4","Task4","Type4","2023-09-24T18:25:36Z","True","Device4","Item4","Access4","OrderType4",503,"Unavailable"
"INVALID005","2023-09-25T19:25:36Z","DOC005","8","InvalidCorrelation005","Request timeout, please try again later","ID005","restore","104","Timeout occurred, response delayed beyond acceptable limits","FieldWork5","Observed5","Reason5","Task5","Type5","InvalidDate005","False","Device5","Item5","Access5","OrderType5",504,"Timeout"