subscriberId,date,associatedDocument,code,correlationOrder,description,id,action,issue.issue.code.code,issue.issue.description.description,fieldActivity,observation,reason,task,type,updateDate,lostEquipment,device,item,gponAccess,order.type,statusCode,scenario
"SVTAL001","2023-09-21T14:25:47Z","VTT001","1","CORR123456789","Success operation","ID12345","Create","100","Issue resolved","Field work","Clear weather","Routine check","Maintenance","Regular","2023-09-21T15:00:00Z","False","ModemX","CableX","GPON123","Standard",204,"Operação realizada com sucesso"
"INVALIDID123","INVALIDDATE","INVALIDDOC","-10","INVALIDCORRELATION","Invalid description data exceeding the maximum length allowed for this field","INVALIDID","Delete","999","Invalid issue description","Invalid activity","Adverse weather conditions","Invalid reason","Repair","InvalidType123","INVALIDDATE","True","InvalidDevice123","InvalidItem123","InvalidGPON","InvalidType",400,"BadRequest"
"UNAUTHID456","2023-09-22T10:00:00Z","UNAUTHDOC","5","UNAUTHCORRELATION","Unauthorized access attempt detected","UNAUTHID456","Update","401","Access denied due to insufficient permissions","Unauthorized access field work","Security breach observed","Unauthorized attempt","System upgrade","Emergency","2023-09-22T10:30:00Z","False","SecurityDevice","SensitiveItem","SecureGPON","Urgent",401,"Unauthorized"
"SERVERERR123","2023-09-23T16:45:00Z","SERVERRDOC","9","SERVERCORRELATION","Server error causing disruption in service","SERVERID789","Retrieve","500","Server crash leading to data loss","Emergency server maintenance","Hardware failure observed","Critical server error","Data recovery","Critical","2023-09-23T17:00:00Z","True","Mainframe","HardDrive","ServerGPON","CriticalRepair",500,"ServerError"
"SERVICE503ID","2023-09-24T11:15:00Z","SERVICE503DOC","0","SERVICECORRELATION503","Service temporarily unavailable due to maintenance","SERVICE503ID","Suspend","503","Planned maintenance work causing temporary unavailability","Planned maintenance","Maintenance ongoing","Scheduled maintenance causing temporary unavailability","Routine maintenance","Scheduled","2023-09-24T12:00:00Z","False","RouterX","SwitchY","MaintenanceGPON","ScheduledMaintenance",503,"Unavailable"
"TIMEOUT504ID","2023-09-25T08:30:00Z","TIMEOUT504DOC","11","TIMEOUTCORRELATION504","Timeout error after prolonged waiting period","TIMEOUT504ID","Pause","504","Timeout due to server overload","High network traffic leading to timeout","Server overload observed","Server unable to handle requests in a timely manner","Traffic management","HighPriority","2023-09-25T09:00:00Z","True","HighCapacityRouter","PerformanceModule","HighTrafficGPON","HighDemand",504,"Timeout"